Review_ID,Rating,Year_Month,Reviewer_Location,Review_Text,Branch
670772142,4,2019-4,Australia,If you've ever been to Disneyland anywhere you'll find Disneyland Hong Kong very similar in the layout when you walk into main street! It has a very familiar feel. One of the rides  its a Small World  is absolutely fabulous and worth doing. The day we visited was fairly hot and relatively busy but the queues moved fairly well. ,Disneyland_HongKong
670682799,4,2019-5,Philippines,"Its been a while since d last time we visit HK Disneyland .. Yet, this time we only stay in Tomorrowland .. AKA Marvel land!Now they have Iron Man Experience n d Newly open Ant Man n d Wasp!!Ironman .. Great feature n so Exciting, especially d whole scenery of HK (HK central area to Kowloon)!Antman .. Changed by previous Buzz lightyear! More or less d same, but I'm expecting to have something most!!However, my boys like it!!Space Mountain .. Turns into Star Wars!! This 1 is Great!!!For cast members (staffs) .. Felt bit MINUS point from before!!! Just dun feel like its a Disney brand!! Seems more local like Ocean Park or even worst!!They got no SMILING face, but just wanna u to enter n attraction n leave!!Hello this is supposed to be Happiest Place on Earth brand!! But, just really Dont feel it!!Bakery in Main Street now have more attractive delicacies n Disney theme sweets .. These are Good Points!!Last, they also have Starbucks now inside the theme park!!",Disneyland_HongKong
670623270,4,2019-4,United Arab Emirates,"Thanks God it wasn   t too hot or too humid when I was visiting the park   otherwise it would be a big issue (there is not a lot of shade).I have arrived around 10:30am and left at 6pm. Unfortunately I didn   t last until evening parade, but 8.5 hours was too much for me.There is plenty to do and everyone will find something interesting for themselves to enjoy.It wasn   t extremely busy and the longest time I had to queue for certain attractions was 45 minutes (which is really not that bad).Although I had an amazing time, I felt a bit underwhelmed with choice of rides and attractions. The park itself is quite small (I was really expecting something grand   even the main castle which was closed by the way was quite small).The food options are good, few coffee shops (including Starbucks) and plenty of gift shops. There was no issue with toilets as they are everywhere.All together it was a great day out and I really enjoyed it.",Disneyland_HongKong
670607911,4,2019-4,Australia,"HK Disneyland is a great compact park. Unfortunately there is quite a bit of maintenance work going on at present so a number of areas are closed off (including the famous castle) If you go midweek, it is not too crowded and certainly no where near as bus as LA Disneyland. We did notice on this visit that prices for food, drinks etc have really gone through the roof so be prepared to pay top dollar for snacks (and avoid the souvenir shops if you can) Regardless, kids will love it.",Disneyland_HongKong
670607296,4,2019-4,United Kingdom,"the location is not in the city, took around 1 hour from Kowlon, my kids like disneyland so much, everything is fine.   but its really crowded and hot in Hong Kong",Disneyland_HongKong
670591897,3,2019-4,Singapore,"Have been to Disney World, Disneyland Anaheim and Tokyo Disneyland but I feel that Disneyland Hong Kong is really too small to be called a Disneyland. It has way too few rides and attractions. Souvenirs, food and even entrance tickets are slightly more expensive than other Disneyland as well. Basically, this park is good only for small children and people who has never been to Disney. The food choices were acceptable, mostly fast food, and not too expensive. Bottled water, however, was VERY expensive but they do have water fountains around for you to refill your water bottles. The parade was pretty good. It was crowded not a problem but what was the problem was the people were just so rude, the pushing and shoving cutting in lines for the rides, gift shops, food stands was just to much to take. forget trying to see one of the shows its a free for all for seats, i don't see how Disney can let this happen, it was by far the worst managed Disney property.",Disneyland_HongKong
670585330,5,2019-4,India,Great place! Your day will go by and you won't even know it. Obviously went there for my daughter and she absolutely loved it! Too bad the parade got canceled though.,Disneyland_HongKong
670574142,3,2019-3,Malaysia,"Think of it as an intro to Disney magic for the little ones. Almost all of the attractions can be completed in 1.5days.One drawback was the timing. For example, Disney's Storybook Theatre is closed Wed Thu for private events. Some restaurants close mid week Tue Thur as well. So best not to plan your visit during mid week.The biggest disappointment is the food at the Park. Even Maxim's is so so only. The only decent Restaurant is Main Street Corner Cafe and the Main Street Bakery. And do be prepared for the typical abrupt HongKong style service from the serving staff.",Disneyland_HongKong
670571027,2,2019-4,Australia,"Feel so let down with this place,the Disneyland train was fantastic until you get past the station,bad signage, terrible staff who just did not want to be there ,it was rainning and rides were not working could not find a map of place, over priced fun park. Disney characters only 2 seen under a cabana having photos with visitors queuing up in the rain. Dont waste your money. Walt Disney would be horrified, not enough eating places for the amount of people or rest rooms. Seems they are building something but who knows what. No atmosphere of fun and fantasy. ",Disneyland_HongKong
670570869,5,2019-3,India,"I can go on talking about Disneyland. Whatever I say about it, is less. Disneyland is all about your childhood dreams come true. Starting from the Entrance, the environment, popcorn, the shows, everything. Even the MTR Trains and the station is specially designed. In my opinion one should by a Two Day Ticket to explore it well if you have time. Else few of the attractions may remain incomplete in one day. An online Two Day Ticket can save around HKD 100 in comparison to an on spot ticket.  Must NOT Miss  attractions include the Jungle River Cruise, Micky's Phillhar Magic (a 4D Show), The Lion King ShowIt is better to have some home work regarding the Show Timings so that you can maximise the number of shows you can cover. It is better to avoid Sundays or the public holidays to avoid rush.",Disneyland_HongKong
670443403,5,2019-4,United States,Disneyland never cease to amaze me! I've been to Disneyland florida and I thought I have exhausted the kid in me but nope! I still had so much fun in disneyland hong kong. 2 DL off my bucketlist and more to come!     ,Disneyland_HongKong
670435886,5,2019-4,Canada,"We spent the day here with our grown kids and I have to admit we had a great time. It seems the kids never tire of Disney. There aren   t as many rides as the states Disney parks but they have some great ones no less. Do the haunted house, catch the lion king show, space mountain, and the iron man experience to list a few. They have lots of shops that you have to spend some money in of course. The kids will love the day!",Disneyland_HongKong
670376905,4,2019-4,Australia,"We spend two days, the second day went early then went straight to the back of the park, no lineups for so children got to go on many rides, some twice in a row. This Disneyland is very suitable for young children ours were 7,6,5,4,3 and 1 so most of them could go on all the rides, it was disappointing the castle was closed no nightly fireworks. Would not like to go in the hot season.",Disneyland_HongKong
670324965,5,2019-4,Philippines,It was indeed the happiest place on earth! My family had really fun and it made my daughter's birthday a memorable one!,Disneyland_HongKong
670274554,5,2018-9,Australia,"This place is HUGE! Definately need more than one day. We had 3 children aged 11, 9 & 6 and they loved it. A great variety of rides and attractions for all ages. Food options were fantastic with 3D models of what you were ordering. Staff were fantastic, very helpful. An awesome family experience. ",Disneyland_HongKong
670205135,3,2019-1,United Kingdom,"We brought tickets before we left and got 2 days for less than the price of 1. After visiting would advise everyone to look for an online deal not worth the walk up price. Castle was closed due to that area being refurbished and altered, weekday aprox no more than a 30 min wait for rides with most being less than that would not recommend weekends or holidays. As has been said like all Disney parks and theme parks in general food and drink is expensive .This is a small park and can easily be done in 1 day",Disneyland_HongKong
670199487,4,2019-4,Myanmar (Burma),"Its huge , not enough to visit in one day. We did with 2 days pass ... all the scenes were amazing ... you were like in movies, fairytales, etc. At 8 pm, we have enjoyed lots with the character show on the street. Must Visit !!! ",Disneyland_HongKong
670129921,3,2019-4,United Kingdom,Around   60 per person and if you want to eat or drink at any point it was cost you a small fortune. If you go on a week day like we did I assume like us you will wait around half an hour per ride. At the time we went the Disney castle was under construction.. it doesn't look like it will be finished soon. Fast track is free for everyone but single rider was a lot faster. An average day at an expensive place. ,Disneyland_HongKong
670099231,4,2019-4,Australia,It   s Disneyland! It just does not need reviewing!  Place speaks for itself.  However smaller than I expected.  Great experience,Disneyland_HongKong
670033848,5,2018-11,Hong Kong,There is nothing more to say except that you become a child once again as you step inside Disneyland in HK!  Easy to go and come out with dedicated trams and subway stations.  Wait for the parade at sunset it is definitely worth waiting!,Disneyland_HongKong
670030877,5,2019-4,United Kingdom,"We bought a 2 day tourist ticket via Klook which made it better value. It was good to have a day to get our bearings and a second day to go on the rides we missed and to go back on our favourite ones again. It also means less queuing.The shows and parades were amazing. We saw the Lion King, Moana and Mickey   s Wondrous Book. Unfortunately there is some works on so the Castle isn   t visible and the train is not open. We still had a magical time.  ",Disneyland_HongKong
670022335,3,2019-4,United States,"First off I'm not a really big Disneyland fan. I live about 20 minutes from the California Disneyland, and haven't been in over 10 years (by choice). We were on vacation in Hong Kong and were able to get free tickets, so why not. First getting there by subway from downtown was super easy. I will say I was impressed with how the train that takes you there was decked out in all the Disney themes. Next the park was okay just super small compared to the one here in California. The castle was under construction so that kinda of sucks and the train didn't run. We went on a Wednesday so it was slow. There are not a lot of rides, so please don't come with that idea. It's a nice place for little kids, but thrill seekers stay at home. One tip make sure you read the description of each ride before you wait in line, because I will never get those 30 minutes of my life back (Iron man experience).",Disneyland_HongKong
670007081,3,2019-4,United States,Mickey and the Wounderous book was great and the kids love it. The new Ant man attraction was good for all ages. Our four year old love the pubs afraid waiting in line because of the loud noises. The 10 year old was afraid of Iron Man   s ride it   s good for 12 and I   ll probably but it was a great ride. The castle is under major construction so there   s no fireworks. Overall the park is still beautiful and wonderful to visit and buy the teacup ride there is a good restaurant that has Standard Chinese food at reasonable prices for Disney. You   ll Have a great day or two. Still probably the best attraction in Hong Kong for children one of the top two for sure. Adults can go on roller coasters and other rides as well they will not be disappointed. ,Disneyland_HongKong
669996858,3,2019-4,Singapore,"I   ve been to Hong Kong Disneyland twice and even with new attractions such as the Ant Man and the Wasp, the experience was really flat and not as enjoyable as other Disneylands in the region. With Sleeping Beauty Castle under renovation, pictures taken at the main square isn   t that appealing with the scaffolding in sight. Souvenirs, food and even entrance tickets are slightly more expensive than other Disneylands. ",Disneyland_HongKong
669783708,5,2019-4,Australia,"GO early if you want to do photos with the signboards and Mickey Donald Duck. Otherwise, you could spend an hour just waiting in line to get a free photo. The paid photo is also available at a price.Tomorrow land Iron Man was excellent and we did it twice.Philar Magic is really awesome.Fantasy Land is great for the rides.Adventure Land has some nice opportunities to take photos with Tarzan, a treetop house visit, a boat cruise for kids.Grizzly Gulch was one of my favourites, Roller Coaster ride was worth the 15 minute wait.",Disneyland_HongKong
669548161,3,2019-4,Hong Kong,Disneylands the world over are generic apart from the language. This was no different than the others. It was a shame about all the building work and some closed eating areas.  Definitely worth a visit if you have young children.,Disneyland_HongKong
669528186,3,2019-4,Australia,"This was my second trip here, the first been about 3 years ago. This is a smallish Disneyland park. The attractions are of a high standard but there are few thrill rides and no outdoor roller coaster. The park was clean and tidy. Food was expensive in the park not of an excellent qualify (ie served like warm or cold) and there were few vegetarian options.The castle was under renovation at the time of my visit. The park is easy to walk around and many of the attractions are great for kids. Lines were virtually non existent with our longest wait 20 minutesOverall worth a visit if you are with the kids in Hong Kong and have the time. The park entry is also comparatively inexpensive when compared to other Disneyland parks.",Disneyland_HongKong
669403596,5,2018-12,Philippines,We have been to Hong Kong Disneyland a few times already but we still want to come back. Why? Because there are rides we were too chicken to try the first visits that we finally had the courage to try and we ended up loving them. We love the Big Grizzly Mountain ride. We thought it will be too scary but we love it now. Will be back again!,Disneyland_HongKong
669353396,5,2019-4,United Kingdom,We visited here on a Wednesday. We arrived for opening and found the queue times to be short and had done most the rides we wanted to by early afternoon. Unfortunately there were no fireworks due to the castle being renovated and we have seen many parades at Disney world so we decided not to stay for the evening. ,Disneyland_HongKong
669186152,3,2019-4,Australia,"I need to say I have been to    home of Disney    Disneyland Anaheim. HK Disney is about an 8th of that park!    Biggest ride    (as in scary) was Space Mountain. Mostly kiddy rides other than that. We did really enjoy the Lion King show. I can   t get over how expensive it was. Water equates to $6 AUD a small bottle and a burger combo meal equated $22 AUD!!!! We also stayed at Disney Hollywood Hotel   where they have u by the balls and charge insane prices ($120 AUD) for buffet dinner or $55 AUD for breakfast. There are no shops   cafes   supermarkets nearby to grab a snack or cheap dinner, unless u take 2 trains! After travelling thru HK  China for 3 weeks it was just crazy expensive for crappy deep fried food or a flavourless bowl of lettuce salad. Very few food places open. Castle under maintenance. Train under maintenance. vouchers we got on the way in stating ALL shops on main st have 10% discount before 1030... then told at bakery    that not here   ?!!! At home that   s called false advertising?!! Toy Story land was insanely hot   no shade, sun bouncing off light concrete   my husband actually had a hypo while waiting for daughter on ride coz it   s so hot. Come on Disneyland... surely you can put up some    camo style shades    so waiting parents don   t pass out?! A few seats for elderly wouldn   t go astray either. All up pretty disappointing experience and about $900 AUD poorer, for 2 adults & 1 child for 2 day pass (note: u won   t need to go back for a second day). ",Disneyland_HongKong
669093045,5,2019-4,Australia,"Took a five year old and a two year old. Could not fault anything other than a hire pram being pinched, which was quickly replaced.  Staff amazing. If you can stay at one of the hotels, do so.  Makes it all much easier.",Disneyland_HongKong
669050447,4,2019-4,Australia,"A great day out even for adults.We can early and we're able to do almost all rides in a couple of hours. The restaurants were great and a good selection of different foods. Try the caramel popcorn! Unfortunately, when we went the bars and 1 restaurant was closed, but still other options available.The rides are mostly for little kids bit a couple were good for adults. The shopping was the highlight of the day with huge selection of Disney gifts and clothing. Note if there is a daily special get it early as it will sell out. There is not a lot of shade so bring hats and an umbrella.",Disneyland_HongKong
668819140,5,2019-4,Australia,"I went to Hong Kong Disneyland with a little trepidation as our family had been to Disneyland in California 6 months previously.No trepidation needed, we all loved HKDL! Loved loved loved it.Yes, its much smaller than California and there are not as many fast paced rides, none the less, we had a great day. The park is beautiful and the experience is just like being at Anaheim.We went on a day where large amounts of rain were expected, so numbers were down. We had line ups of less than 5 minutes on most rides. The rain held off until 3pm and we'd been able to go through all of the park by that time and we were going back over rides we wanted to do again. Once the rain started we found that most people huddled under their umbrellas, where as we went on all the undercover rides over and over.I totally recommend HKDL, just keep in mind it is smaller and slower paced than other Disney parks.",Disneyland_HongKong
668798543,5,2019-4,China,"This Disneyland is a lot of fun. There are many rides that are good like the Iron man experience, hyperspace mountain, the toy story car, and many others. I went to Shanghai Disneyland as well and that one is so crowded you can   t go on a lot of rides but in Hong Kong we were able to ride almost every ride in a day. Lines were very short and the park is small so it   s easy to get around. ",Disneyland_HongKong
670801367,5,2019-4,United States,"This place has always been and forever will be special. The feeling you get entering the park, seeing the characters and different attractions is just priceless. This is definitely a dream trip for all ages, especially young kids. Spend the money and go to Disneyland, you will NOT regret it",Disneyland_California
670760708,5,2019-4,United States,"A great day of simple fun and thrills. Bring cash, nothing is cheap, but we knew that it's Disney. But they are great letting you bring in your own food, drinks, etc but read the list closely, we list several items at the entry gates (selfy sticks, glass refill bottles, etc). It is worth buying the photo pass and fastpass. Have fun! ",Disneyland_California
670565072,4,2019-5,Australia,All and all a great day was had. The crowds are huge and ride times sometimes up to a 50 min wait but worth it. Very disappointed the castle was under repair and covered but we understood. If you want to take a short cut on the rides grab a Max Pass for 15 each it allows you to book a time every 90mins and believe me it's a great feeling floating past the ques. ,Disneyland_California
670544335,5,2019-4,United States,"Having been to the Florida location numerous times over the years I didn't know how this one would compare. The much smaller footprint made it quicker easier to get from ride to ride. The Cinderella's castle was much much smaller, but also being renovated. Many of the rides were identical, while some were notably different. The Indiana Jones Ride (which FL does not have) was awesome. Space Mountain was much more puke worthy. It's a Small World was way more beautiful from the exterior. They had several of the old rides that FL doesn't have (like Pinocchio and Mr. Toad). I LOVE how their fast passes worked... it was easy to use and we were able to use them back to back on rides, fast passing almost everything we wanted to ride. We went the first week of April and while crowded, I didn't think it was too bad. We were only in the park for like 7 hours and I do wish I'd had about 3 more hours to do everything.",Disneyland_California
670472278,5,2019-4,Canada,"Had the 4 day pass, spent 3 at DL and one at CA. Great place to visit. We will be back. Saw a lot in those days, but there is more that we missed, and more we want to see again.",Disneyland_California
670382191,5,2019-4,Lebanon,Oh my god you can really forget your self and enjoy everything you face there its a huge word of fun,Disneyland_California
670303452,5,2019-3,United States,"We were so sad that the castle was under refurbishment, but we didn   t let it ruin our good time. I purchased the Maxpass before we went and it was super easy to use and very convenient. Maxpass includes free pictures taken by Disney photographers. I have been to Disney World and there is no shortage of photographers. This was not the case here. They definitely need to add more. We were able to do all of the rides that we wanted to do, and we got the snacks that we wanted to try. We spent two days here and on the last day we watched the Fireworks show. It was amazing. All of the workers were polite and helpful. ",Disneyland_California
670215409,3,2019-4,United States,"Took my son to the Park on a weekend(Fri Sun). Very busy all over the places. My son enjoyed it, but he was very sad that he could not try a lot of attractions as the wait time was huge.....( ranging from 60 90 minutes) If you have a lot of time to waste waiting in the line for the attractions, FASTPASS system at the park is just a ripoff. You can have only one attraction added to your plan at any point, once you complete that attraction you can add one more. ",Disneyland_California
670204404,5,2018-11,United States,"There's nothing like Disneyland and it should be on your  bucket list  if you've never been. Park is well maintained and parking is OK, but not cheap at $25. Tickets can cost up to $150 per adult (10 years old and up) during  peak  periods. Food is not cheap either. If you take a family without a season's pass, you could easily spend hundreds of dollars just on admission tickets. If you go frequently, get a Disney credit card to get free park perks and park promotions. Downtown Disney is also a fun place to visit.",Disneyland_California
670164415,5,2019-4,United States,"I think it   s because going to Disneyland is one of my earliest memories, but I just love visiting the park every few years. You won   t find a place with friendlier more helpful staff and the entire park is so clean. Yes, it   s expensive for many and there are crowds, but you can adjust the timing of your visit for fewer crowds and you can visit on a budget if you plan ahead. It   s such a special place for so many people and kids enjoy themselves too. There are loads of online resources on how to visit on a budget such as staying at an offsite hotel and bringing your own snacks and meals. I highly recommend that everyone try it once, but be warned, it   s highly addictive. ",Disneyland_California
669945103,5,2019-4,United States,"I   ve been going to Disneyland since the early 60   s, and the Magic never gets old . This was my 4th visit this year. We have developed a strategy that works best for us. We stay at a Disney resort and you can get in at 0700. We can actually get on about 5 rides in less than 2 hours. As the day goes on the crowds thicken and wait times are over an hour making it difficult to experience everything. Max pass is worth the extra $. By nightfall the crowds can be overwhelming , so early is better. ",Disneyland_California
