Review_ID,Rating,Year_Month,Reviewer_Location,Review_Text,Branch
669762024,5,2019-4,United States,"The last time I was here, the area Disney's California Adventure now occupies was the parking lot; it was magical then and through the years and changes, the magic remains. This was the first visit for my wife and daughters and they thoroughly enjoyed themselves. I could go every year and never get tired of it (I understand why some people opt to get annual passes)!To guard against disappointments; research, research, research. I cannot stress that enough. If there is an attraction that you have your heart set on experiencing, check multiple sources to see if it is undergoing a refurbishment and what the timeline for said refurbishment could be. I knew castle would be encased in scaffolding and would not be visible during our visit. However, it did not detract from our experience. If you have friends and or family members who recently went, hit them up for advice and learn from their experiences.Another thing, expect crowds regardless of what time of year it is. Granted, some times of the year can be busier than others. We were fortunate that the time we were here, crowds were not overwhelming, fastpass return times were reasonable, and we didn't have to wait too long on the rides where everyone rides standby.Use the app; it will really, really help you;seeing standby times and fastpass return times can help you adjust your plan to how things are at the moment or help you decide what to do next. It will also help you locate where specific characters are and when they will be there.Lastly, I highly recommend seeing Mickey's Soundsatonal Parade from start to finish. I also highly recommend seeing both night shows (Fantasmic & Mickey's Mix Magic). If you want to catch the earlier Fantasmic show, you should probably go get your fastpasses for it right after rope drop as the earlier show will likely go fast. By the time I went to get our passes, only the later showing was available.",Disneyland_California
669706763,3,2019-4,Canada,"This is going to be a lengthy review, only because this trip had been planned for over a year. Let's start with the lines. Now, myself and 4 others had planned this trip for over a year, we went Easter long weekend and we already were fully expecting it to be busy. We had a 5 day park hopper pass to be able to get on everything and enjoy both parks fully. The Friday, and Sunday were the least busiest days and the most enjoyable. But, there are lines for everything! Lines to get your bags checked, lines to get in, sometimes lines well past the monorail and took 30 minutes or more and lines for rides of up too 120 minutes or more! These parks are so packed full its impossible to move around. Fast pass is a joke unless you get to them early! Got a fast pass at 10 am and was to come back at use it at 6:30pm! The rides: With the 5 days we did manage to get on everything at least twice. But more often then not Indiana Jones was broken. Space Mountain went down a few times, Splash Mountain went down, Big Thunder Mountain, Incredibles Coaster, pretty much everything was broken at one time or another. Waited in line for 45 minutes for Cars before being given a fast pass and told it was broke at about 7pm, it never did reopen that night. If you only have a day pass or hell even 3 days the wait times and the amount of broken down rides would make it near impossible to get on everything. Food: Maybe I am picky, but my friends agreed it was near impossible to find anything decent here. The Red Rose Tavern wasn't bad but it was fast food and it wasn't exactly cheap or anything to rave about. Odered a burger and it was ready before I was done paying! The Grey stuff was pretty delicious though! I can't understand why the Bengal Barbeque has such great reviews. It cost me $5:50 for a chicken skewer that has 3 little pieces of chicken on it! We did the $30 dinner and Fantasmic tickets with the Hungry Bear resturant and what a joke! You got a piece of chicken and or salmon, Rice with cranberries and peaches in it (yuck!) And a arugula salad with chick peas. It came in a plastic container like something from a cafeteria. The Blue Bayou was the only place in Disney that was absolutely blow your mind fantastic. It is not cheap however it was a splurge dinner. The best food we food was outside the park! Better food and prices! Ot is nice they let you bring in water and food now since a water bottle cost $4.50! The churro stands were really good and so was the popcorn stands. The Wine Country Trattoria in California Adventure was very good! Amazing pasta and wine pairings and we did the World of Color package and we got excellent seats for $50 a person. The shows: Fantatsmic and World of Color are incredible and must watch while your here! Get there early to get good seats and don't be suckered into the dinner and show packages for Fantasmic! The one through Hungry Bear was a massive disappointment! The food was terrible and we were told to get there by 8pm but they had already started seating people way before that! We were sat on the side and were obstructed by lamp post and a gate! We saw Fantatsmic the second night and went early, stood on the bridge and it as a primo spot! The World of Color we did the dinner and show through The Wine Country Trattoria and there the food was fantastic and the seats were right up front! That was a $50 package and that was worth it! Overall I've learned a lot from this experience. I would love to come back but may better select our dates. From reading other reviews though sounds like they over pack these parks no matter the time of year. For how much you pay, the wait times and food are just not worth is. Eat outside the park, get fast passes when you can. Hope lady luck is on your side and the rides aren't all broken down. For how much money they must make the rides are always broken!!It was fun, made some great memories, I guess I just expected more but if felt like a money grab everywhere you turned. ",Disneyland_California
669660324,2,2018-10,United States,It is no doubt a legendary place but I just dont think it's worth the money and headache of overcrowding and overpriced everything. Disney continues to raise the price of admission and the crowds are ridiculous every single day. There are plenty of things to do in SoCal that are cheap or free. Save your family hundreds of dollars and go somewhere else. ,Disneyland_California
669624661,5,2019-4,United States,I always love to go to Disney land. The kids have a blast as well as adults.  Downside is that it's to crowded not alot of room,Disneyland_California
669535760,5,2019-4,United States,"Who knew? Easter Day is light! No line was more than 25 minutes wait, and that was the popular rides! Great day   definitely hit Indiana Jones, Thunder Mtn & the Matterhorn.",Disneyland_California
669505006,1,missing,United States,"I   ve been to Disneyland several times in the past 3 decades. This visit, I sensed the employees were disgruntled or unhappy. Very few smiles from the staff. In addition, the staff was prowling for people crossing the ropes while Fantasmic was on. Why do we need a Fastpass to enter to watch the Fan tasmic show when everyone has been situated and there is tons of space for paying customers without a Fastpass? See attached picture. Through the whole show, the entire space was unoccupied while there were 5 8 yr olds next to us straining to catch a glimpse.If you wanna pay $129 to stand in line for hours to ride an average of 9 rides that last 3 to 11 minute, this is the place for you. Disneyland has become so greedy that they overcrowd by double capacity just to make money without a care for their customers. It   s ridiculous to have minimal places to sit and rest with this large of a park. I highly recommend Universal Studios VIP pass over this mess.",Disneyland_California
668986571,5,2019-4,United States,Last time I was there was for Grad night in 1978. My wife won Disney tickets for 4 so we took our youngest granddaughter. Many of the sights I remember and haven't changes a whole lot.The experience was great and i thought the afternoon parade was outstanding. Definitely will not be waiting another 40 years before returning.,Disneyland_California
668793602,4,2019-4,United States,"Honestly,if you are reading this review then you are seeking different tips for the Disneyland park experience. Once you decide to visit, there is no turning back. Every person should have at least one experience with Mickey, Minnie and their entourage. Hack 1.Prepay your ticket. Park at Downtown Disney. Parking rate is the same at the park. Every minute counts and waiting to park then catch the tram is wasted minutes. Board the monorail located in Downtown Disney and you will be delivered in Tomorrowland (near space mountain). That's right, you skip all entry lines. Your pre purchased ticket is entry at the monorail boarding station. If you desire to take pictures at the entry of Disneyland then this is not a hack for you. Hack 2.The Disneyland Railroad, East of the monorail deboarding station, takes you around the entire park and different entry points of the various lands. The train ride is fun, it is an actual attraction, and you see much of the park, and boarding at Tomorrowland is less crowded than the other points. I highly recommended that you complete the full tour and then map your experiences of what to do next. Pirates of the Caribbean is always a long wait. I would recommend to begin your day in New Orleans Square, where much of the popular attractions are located.Hack 3.Late November to early January is the most beautiful time of the year to experience Disneyland. I find it less crowded and wait line times are 60 minutes and less. I've been going to Disneyland when there were colored tickets to get on the rides. Did I just date myself?Disneyland is overpriced. Food is uneventful, yet the New Orleans Square has good food. Food is pricey. Lines can be so long that your 8 hour day may only be 4 rides. Families come to Disneyland for a technology alternative (togetherness), unfortunately, the long lines will tempt you to take out your phones to entertain your children rather than endure the complaining. Parades and other events are worth delving into. Let me know how these hacks optimize your experience.",Disneyland_California
668772767,5,2019-1,Australia,Pure magic for both children and adults alike. Happiest place on Earth   how can you not be happy at Disneyland! Sure it is a little expensive but when you really immerse yourself in the experience it is money well worth spending. We had 4 days   3 nights and purchased the park hopper tickets. Definitely recommend the park hopper as you can come and go as it suits. ,Disneyland_California
668759002,4,2018-5,New Zealand,"Great place for people like me that prefer the more relaxing in life than the thrill seekers.Its never been a cheap destination and it has only increased in price but I would still recommend it at least once Pirates of the Caribbean, Big thunder railroad, Indiana Jones rides have always been go to for me",Disneyland_California
668734266,5,2019-4,United Kingdom,We found this park to provide family friendly fun with a variety of shows and rides. We pre paid our tickets to save time which was a benefit and were glad we paid extra for the park hopper tickets which give flexibility to move between the parks as you wish over the days to suit the rides   attractions you want to do. I enjoyed this park the most. There is a range of eateries so not just fast food and there are lots of shopping options for Disney merchandise if that   s what you like.We enjoyed the mix magic fireworks   music   light show every day and only wished we had watched the other show also. The parade was fun too and both were impressive.There can be long queues for some rides but waiting times vary and are displayed to inform your decision although fast pass could be purchased for an extra cost when we visited. We also found that around show   parade times queues reduced for some rides.,Disneyland_California
668730191,2,2019-4,United Kingdom,"My partner and I paid $149 each for tickets to this park as my partner wanted to see the original Disney castle.When paying for the tickets nothing was mentioned about a couple of issues we had.Firstly we walked through and tried to take a photo using a selfie stick to be told we either have to throw it away or take it back to the car or hotel as they are banned. So we had to leave and come back again.Then once we finally got back in we saw countless people with cameras on selfie sticks which was very annoying, but not as annoying as them not pre telling us before paying that the castle isn   t even visible as they are working on it or something. It was just wooden panels with a castle painted on it so we paid full price for partial access and activities to be available to us.We should have been told as we   d have left the park for another LA holiday and not wasted $300.Disney this is unacceptable and a true disappointment The only good thing was out breakfast in the Carnation Cafe where the staff were superb and the Apple cinnamon pancakes to die for.All in all a very expensive disappointing day thanks to Disney not pre advising people at the gate as to what works were or are being carried out.",Disneyland_California
668642940,5,2018-7,United States,Disneyland is always a magical place to visit with friends and family or even on your own for a day!,Disneyland_California
668497633,5,2019-4,Australia,"My wife and I loved Disneyland..We spent 3 days with a 3 day Hopper pass in between California Adventure and Disneyland...We still could have spent more time in both..The family and happy atmosphere is compulsive and can   t wait to get back. Stay for the fireworks down Main Street. Plenty of wifi hot spots, food stores and great gift shops..unexpectedly good rides like the Small Small world in Fantasyland are a must...",Disneyland_California
668473655,5,2019-4,United States,"This was our first visit to Disneyland after two previous visits to DW. We felt slightly cheated as they were refurbishing the castle and it was closed down, however, we had a great time. We did the adult only thrill seeking ride thing. We really enjoyed Indiana Jones (but make sure you   re in the front), The Haunted Mansion and Pirates of the Caribbean rides. HM and Pirates are both much better than DW. ",Disneyland_California
668205119,5,2019-4,Philippines,"I wish they had better food restaurant choices, but the attractions make up for this deficit so it's all good.",Disneyland_California
668183645,5,2019-4,United States,"I   m a Florida resident so Disney world holds a special place in my heart. We only had time to visit 1 park in Anaheim and everyone else was pushing for Disneyland. I really wanted to go to California adventure. So glad i was out voted. Disneyland is so adorable and quaint compared to the much larger Disney world. The lines were much shorter, the people much friendlier and you could see the parade right from the lines! It was great. Happy I went.",Disneyland_California
668118511,4,2019-4,United States,So here are the pros:Lots of characters located throughout the parkFun rides Incredible shows Overall atmosphere ConsLong lines Fast pass not what you think (although it does help) Not as many rides for the 11 year old plus compared with other parks Summary : nice place to visit at least once in your life to say you have been there. We really enjoyed the overall atmosphere at Disneyland but the fast pass was not what you think as you can get two to three rides per day. For adults that are pretty chill waiting in long lines isn   t a big deal but with crazy twins it can make it a little challenging . Wish there was a true fast pass you could pay extra for to make the overall experience better. I   d give it a solid B grade wise but liked Universal much better ,Disneyland_California
668062117,5,2019-4,United Kingdom,"Great place, please do not hesitate in visiting Disney.  The shows, the rides and the food.  Everything it   s perfect",Disneyland_California
667955757,1,2019-1,Australia,"To all who comes to this happy place, welcome. Well Walts vision has been lost along the way over the past few years as this is my third and final trip to Disneyland. I have never experienced so many rude and obnoxious staff throughout the park as we did this time. If the staff are that unhappy with their jobs or pay then step aside and give a job to someone who wants to work. Disney has just turned into a massive cash cow who can't handle the large crowds but keep jamming people into the park until it becomes uncomfortable. We were fully aware of the large crowds of the Christmas period but disneyland promoted activities for you to enjoy and when we arrived at these events people were being moved along by staff, saying that you cannot stand there.Disney have made WiFi available in the park aswell and this just leads to people not watching where they are going because all people are doing is looking at phones instead of watching where they are walking.Do yourself a favor and go to Knotts Berry Farm, its a lot cheaper and not as crowded.",Disneyland_California
667949122,5,2019-3,United States,"The original is the best, and taking my kids gave me the chance to feel what my parents did 30  years ago when they took me. The park does everything right, from the decor, to the facilities, to the staff.Pay extra for the MaxPass feature with photos. It's excellent, allowing you to get Fast Passes on your phone, and get the staff to take your picture for you.The rides ate great, and so are the shows. Can't say enough good things.",Disneyland_California
667858131,5,2019-4,Canada,Had a fun couple of days :) FastPass was so worth it! The park is not as big as I expected and you could pretty much see do everything in two days. The dance party at night (9:30pm   with the fireworks) was actually so much fun and as an adult I wasn't expecting it haha.,Disneyland_California
667857090,5,2018-5,United States,"Get on your comfy clothes and shoes, have cash, sunscreen, sunglasses and be prepared to wait sometimes. Relax and give in to the experience and have a fantastic time.",Disneyland_California
667491422,5,2019-4,United States,"This was our first trip to Disneyland. We live on the East Coast and I have been to Disney World many times (like 30 ). I actually found some things at Disneyland to be nicer. Likewise some things I prefer at Disney World. I wouldn   t say one is nicer than the other, just different. Even the same corresponding rides are different at each park. For example, I found the Haunted Mansion and It   s a Small World to be nicer here and Splash Mountain better at Disney World. I love that they have a parking deck at Disneyland. It   s only been there since 2001 or so because where California Adventure is now is what used to be part of their parking lot. I think it looks very nice that the sidewalks are brick as a pass to the pink colored concrete of Disney World. The brick looks more aesthetically pleasing. Cinderella   s castle at Magic Kingdom Florida is prettier though I think it looks very nice that the sidewalks are brick as opposed to the pink colored concrete of Disney World. The brick looks more aesthetically pleasing. Cinderella   s castle at Magic Kingdom in Florida is prettier than Sleeping Beauty   s though. I really love this park and will be back!",Disneyland_California
667490475,5,2019-4,United States,"EXPENSIVE!    Value    for your money...PRICELESS! That   s RIGHT Mouseketeer   s...Disneyland Resorts ARE the HAPPIEST places on earth! Period, end of story...love it or leave it! Year after year we make at LEAST one trek to this place in Anaheim, CA to revel in our own Epicureanism! And it   s worth every penny. Parking at this point is $25 per day (preferred parking is more). Tickets start at $140 per day (at the ticket booth). If your good with that, then GO and once you   re in the Park...LET GO, RELAX, and FORGET ALL YOUR WORRIES! The Rides, the Atmosphere, the Food, the Cleanliness, the incredible sculpted Plantings and all those FABULOUS Disney Team Members will take your breath away! The BEST part...just BEING there...the worst part, LEAVING! It can be crowded, so do your due diligence on line before hand. We have NEVER had the experience where we were disappointed due to the amount of people in attendance. Blackout days WILL BE CROWDED...that   s why they are    Blackout days   ! Be sure to stay long enough to enjoy the evening FIREWORKS (SPECTACULAR and EVERY night)! Planning 6 months to a year in advance is your best bet. As soon as we leave and get home from a wonderful Disneyland Vaca, we are planning the next visit. This week, in this Reviewer   s opinion, Disneyland has earned this    highly recommend    5 Points review!",Disneyland_California
667376527,5,2019-4,United States,I found I liked Disneyland better than Disney World. It is not so overwhelming. Sweet could have easily spent more time just soaking it in. Every detail has been attended to as well as it is sooo clean!,Disneyland_California
667084672,4,2019-4,Australia,"This iconic theme park has a lot to offer and it is worthwhile doing some homework before committing to a visit. Check favourable times in terms of potential overcrowding, research deals to take advantage of dynamic pricing and install and master the fast pass app. Also, as far as possible, check on any maintenance scheduled for landmark attractions and rides.",Disneyland_California
667081128,5,2019-4,United States,"I took my four year old son to Disneyland two weeks ago and the glow still hasn't worn off. It was legitimately the greatest day of his life. Both as a kid and as a parent watching a kid, going to Disneyland is one of the best parts of living on Earth. Absolute bucket list item for everyone on the planet. So special.",Disneyland_California
666821668,5,2019-4,United States,Best trip ever! It all started at the Grand California with one of the best customer service moves ever. I recently broke my leg and was expecting on renting a wheelchair. I ran into on of my old friends who worked at valet. After catching up for about a half hour I politely asked if they had wheelchairs so I didn   t have to walk to the whole way to the park. In a blink of an eye he went back to the back room and pulled one out for me. I had a fully automatic wheelchair for the park. Disney   s cast and crew were extremely accommodating in regards to the chair. Saved the trip!,Disneyland_California
666819537,5,2019-4,United States,Traveled to Disneyland with my sister and niece!! We all have been to Disney World several times. Was surprised how close in proximity the parks were in land as apposed to world!! Everything was magical!!,Disneyland_California
666801789,5,2019-3,Australia,Loved loved loved. Not my first visit to a Disney park but it was absolutely great. Wait times were a little high as it was in the beginning spring break but def worth it. Food is a little expensive so if you want make sure you fill up on a massive breakfast to sustain you though the day. Unfortunately the castle was under refurbishment or something as it was all covered up which was sad but hey Disney is Disney : ) ,Disneyland_California
666796062,5,2018-8,Australia,"A little expensive in some areas but a great variety. Food vendors everywhere, no shortage.  The park was a magical place, loved every moment, ride, show.  Fantastic!  Love Fantasia!  Would love to go back!  Great experience, had a 3 day pass and needed it!",Disneyland_California
666790455,5,2019-3,United States,Long lines   2 1 2 hrs for one ride was a little much for active kiddos.  But the ride was great once we got on it..,Disneyland_California
666722948,5,2019-4,United States,I can never get enough of Disneyland it never disappoints. Always clean and workers are great! We will be back,Disneyland_California
666665841,5,2019-4,United States,"We spent two days at Disneyland. We had a MaxPass (totally worth it), which was awesome so we were able to do every ride   some two or three times. We loved every minute of it. The classic rides are still so fun and remarkable to think of when they were created. The newer ones are super fun and thrilling. We all had different favorites   Space Mountain, Star Tours, Autopia, Jungle Cruise, Big Thunder, Haunted Mansion, Splash Mountain. The employees are incredibly helpful and kind. The park is super clean. And Fantasmic is just jaw dropping   you have to go see it.",Disneyland_California
666536505,5,2019-4,United States,"We went with our family and had a great time, although the grandparents needed a nap one day. The Disney app is excellent for wait times on favorite rides and it can be a little crowded on weekends. The cast members and staff are so accommodating. Happiest place ever!",Disneyland_California
666534210,5,2019-4,Australia,"Our 4 day park hopper pass with Maxipass allowed us to experience every ride at least twice and avoid the long queue of up to 2 hours on some rides. It is definitely the happiest place on Earth. All the staff were pleasant and helpful, the grounds were clean and vent kids I long lines were happy and patient. I would recommend the Maxipass to make full use of your time in the park. ",Disneyland_California
